10:37:45.023347 IP 192.168.43.223.32845 > 192.168.43.163.53: 58953+ A? beta.osintvillage.org. (39)
10:37:45.023365 IP 192.168.43.223.32845 > 192.168.43.163.53: 33105+ AAAA? beta.osintvillage.org. (39)
10:37:46.135132 IP 192.168.43.163.53 > 192.168.43.223.32845: 58953 2/0/0 A 104.18.44.57, A 104.18.45.57 (71)
10:37:46.135283 IP 192.168.43.163.53 > 192.168.43.223.32845: 33105 2/0/0 AAAA 2606:4700:30::6812:2c39, AAAA 2606:4700:30::6812:2d39 (95)
10:37:46.135650 IP6 2804:18:14:217d:eb35:b295:bdd6:16a1.39042 > 2606:4700:30::6812:2c39.443: Flags [S], seq 295811893, win 27000, options [mss 1350,sackOK,TS val 2908333774 ecr 0,nop,wscale 7], length 0
10:37:46.207875 IP6 2606:4700:30::6812:2c39.443 > 2804:18:14:217d:eb35:b295:bdd6:16a1.39042: Flags [S.], seq 566033769, ack 295811894, win 2048, options [mss 1360,nop,nop,sackOK,nop,wscale 10], length 0
10:37:46.207931 IP6 2804:18:14:217d:eb35:b295:bdd6:16a1.39042 > 2606:4700:30::6812:2c39.443: Flags [.], ack 1, win 211, length 0
10:37:46.209335 IP6 2804:18:14:217d:eb35:b295:bdd6:16a1.39042 > 2606:4700:30::6812:2c39.443: Flags [P.], seq 1:518, ack 1, win 211, length 517
10:37:46.337659 IP6 2606:4700:30::6812:2c39.443 > 2804:18:14:217d:eb35:b295:bdd6:16a1.39042: Flags [.], ack 518, win 28, length 0
10:37:46.359605 IP6 2606:4700:30::6812:2c39.443 > 2804:18:14:217d:eb35:b295:bdd6:16a1.39042: Flags [.], seq 1:1351, ack 518, win 28, length 1350
