22:50:05.679616 IP 10.10.10.5.56497 > 20.36.219.28.443: . 3131941409:3131942821(1412) ack 611385749 win 512
22:50:05.679649 IP 10.10.10.5.56497 > 20.36.219.28.443: P 1412:1538(126) ack 1 win 512
22:50:05.680197 IP 10.10.10.5.56497 > 20.36.219.28.443: . 1538:2950(1412) ack 1 win 512
22:50:05.680220 IP 10.10.10.5.56497 > 20.36.219.28.443: P 2950:2965(15) ack 1 win 512
22:50:05.816139 IP 20.36.219.28.443 > 10.10.10.5.56497: . ack 2965 win 2051
22:50:05.834787 IP 20.36.219.28.443 > 10.10.10.5.56497: . 1:1413(1412) ack 2965 win 2051
22:50:05.834790 IP 20.36.219.28.443 > 10.10.10.5.56497: P 1413:1577(164) ack 2965 win 2051
22:50:05.834968 IP 10.10.10.5.56497 > 20.36.219.28.443: . ack 1577 win 512
22:50:06.306892 IP6 2804:58:81C6:8600:B12B:7037:8002:6C0.54990 > 2A03:2880:F205:2C5:FACE:B00C:0:167.443: P 1230212229:1230212260(31) ack 355394159 win 512
22:50:06.318687 IP6 2A03:2880:F205:2C5:FACE:B00C:0:167.443 > 2804:58:81C6:8600:B12B:7037:8002:6C0.54990: . ack 31 win 241
